{
  "header": {
    "schema": "clip_ready",
    "schema_version": "0.1.0",
    "msg_id": "7f3c2a10-5b6e-4c1d-9a07-0c1d2e3f4a5b",
    "uav_id": "uav-01",
    "mission_id": "M-20261002-001",
    "stamp_utc": "2026-10-02T03:14:32.300Z",
    "producer": "embedded/camera_recorder@0.1.0"
  },
  "view_id": 1,
  "clip_id": "M-20261002-001/v1",
  "uri": "file:///data/missions/M-20261002-001/clips/v1.mp4",
  "media": {
    "container": "MP4",
    "width": 1920,
    "height": 1080,
    "fps": 30.0,
    "n_frames": 60,
    "duration_s": 2.0,
    "sha256": "70902fbc6423b4720921ca8b4d9846e317544a02139858a35d62dfccbfce4361"
  },
  "camera": {
    "model": "SIYI A8 mini",
    "hfov_deg": 81.0,
    "vfov_deg": 51.0,
    "intrinsics": null
  },
  "frames_meta_uri": "file:///data/missions/M-20261002-001/clips/v1.frames.jsonl",
  "view": {
    "bearing_from_target_deg": 135.0,
    "horizontal_range_m": 150.0,
    "height_above_target_m": 100.0,
    "gimbal": {
      "mode": "LOOK_AT_TARGET",
      "pitch_offset_deg": 5.0,
      "yaw_offset_deg": 0.0
    },
    "hover_s": 2.0
  },
  "pose_mean": {
    "lat_deg": 21.822659,
    "lon_deg": 105.215842,
    "alt_amsl_m": 288.6,
    "height_agl_m": 104.2,
    "yaw_deg": 315.2,
    "gimbal_pitch_deg": -28.9,
    "gimbal_yaw_deg": 315.0
  },
  "target": {
    "lat_deg": 21.823614,
    "lon_deg": 105.214821
  },
  "target_ground_amsl_m": 184.4,
  "sun": {
    "azimuth_deg": 148.3,
    "elevation_deg": 52.7
  },
  "settle": {
    "pos_rms_m": 0.42,
    "gimbal_rms_deg": 0.31
  }
}
